{
  "$schema": "https://json-schema.org/draft/2020-12/schema",
  "$id": "https://example.invalid/gezeitenkarten/puzzle-v1.schema.json",
  "title": "Gezeitenkarten puzzle v1 (5×5 chart, 1–6 hours)",
  "type": "object",
  "properties": {
    "schemaVersion": {
      "const": 1
    },
    "dataVersion": {
      "type": "integer",
      "minimum": 1,
      "maximum": 2147483647
    },
    "id": {
      "type": "string",
      "pattern": "^[A-Za-z0-9][A-Za-z0-9._-]*$",
      "maxLength": 80
    },
    "logic": {
      "type": "object",
      "properties": {
        "grid": {
          "type": "object",
          "properties": {
            "columns": {
              "const": 5
            },
            "rows": {
              "const": 5
            }
          },
          "required": [
            "columns",
            "rows"
          ],
          "additionalProperties": false
        },
        "start": {
          "type": "string",
          "pattern": "^[A-E][1-5]$"
        },
        "steps": {
          "type": "integer",
          "minimum": 1,
          "maximum": 6
        },
        "blocked": {
          "type": "array",
          "items": {
            "type": "string",
            "pattern": "^[A-E][1-5]$"
          },
          "minItems": 0,
          "uniqueItems": true
        },
        "places": {
          "type": "object",
          "propertyNames": {
            "type": "string",
            "pattern": "^[A-Za-z0-9][A-Za-z0-9._-]*$",
            "maxLength": 80
          },
          "additionalProperties": {
            "type": "object",
            "properties": {
              "kind": {
                "enum": [
                  "island",
                  "lighthouse",
                  "reef",
                  "wreck",
                  "landmark"
                ]
              },
              "cells": {
                "type": "array",
                "items": {
                  "type": "string",
                  "pattern": "^[A-E][1-5]$"
                },
                "minItems": 1,
                "uniqueItems": true
              }
            },
            "required": [
              "kind",
              "cells"
            ],
            "additionalProperties": false
          }
        },
        "clues": {
          "type": "array",
          "items": {
            "oneOf": [
              {
                "type": "object",
                "properties": {
                  "id": {
                    "type": "string",
                    "pattern": "^[A-Za-z0-9][A-Za-z0-9._-]*$",
                    "maxLength": 80
                  },
                  "type": {
                    "const": "direction"
                  },
                  "hour": {
                    "type": "integer",
                    "minimum": 1,
                    "maximum": 6
                  },
                  "direction": {
                    "enum": [
                      "E",
                      "SE",
                      "SW",
                      "W",
                      "NW",
                      "NE"
                    ]
                  }
                },
                "required": [
                  "id",
                  "type",
                  "hour",
                  "direction"
                ],
                "additionalProperties": false
              },
              {
                "type": "object",
                "properties": {
                  "id": {
                    "type": "string",
                    "pattern": "^[A-Za-z0-9][A-Za-z0-9._-]*$",
                    "maxLength": 80
                  },
                  "type": {
                    "const": "turn"
                  },
                  "hour": {
                    "type": "integer",
                    "minimum": 2,
                    "maximum": 6
                  },
                  "degrees": {
                    "enum": [
                      -180,
                      -120,
                      -60,
                      0,
                      60,
                      120,
                      180
                    ]
                  }
                },
                "required": [
                  "id",
                  "type",
                  "hour",
                  "degrees"
                ],
                "additionalProperties": false
              },
              {
                "type": "object",
                "properties": {
                  "id": {
                    "type": "string",
                    "pattern": "^[A-Za-z0-9][A-Za-z0-9._-]*$",
                    "maxLength": 80
                  },
                  "type": {
                    "const": "position"
                  },
                  "hour": {
                    "type": "integer",
                    "minimum": 0,
                    "maximum": 6
                  },
                  "cell": {
                    "type": "string",
                    "pattern": "^[A-E][1-5]$"
                  }
                },
                "required": [
                  "id",
                  "type",
                  "hour",
                  "cell"
                ],
                "additionalProperties": false
              },
              {
                "type": "object",
                "properties": {
                  "id": {
                    "type": "string",
                    "pattern": "^[A-Za-z0-9][A-Za-z0-9._-]*$",
                    "maxLength": 80
                  },
                  "type": {
                    "const": "adjacentToPlace"
                  },
                  "hour": {
                    "type": "integer",
                    "minimum": 0,
                    "maximum": 6
                  },
                  "place": {
                    "type": "string",
                    "pattern": "^[A-Za-z0-9][A-Za-z0-9._-]*$",
                    "maxLength": 80
                  }
                },
                "required": [
                  "id",
                  "type",
                  "hour",
                  "place"
                ],
                "additionalProperties": false
              },
              {
                "type": "object",
                "properties": {
                  "id": {
                    "type": "string",
                    "pattern": "^[A-Za-z0-9][A-Za-z0-9._-]*$",
                    "maxLength": 80
                  },
                  "type": {
                    "const": "distanceToPlace"
                  },
                  "hour": {
                    "type": "integer",
                    "minimum": 0,
                    "maximum": 6
                  },
                  "place": {
                    "type": "string",
                    "pattern": "^[A-Za-z0-9][A-Za-z0-9._-]*$",
                    "maxLength": 80
                  },
                  "distance": {
                    "type": "integer",
                    "minimum": 0,
                    "maximum": 8
                  }
                },
                "required": [
                  "id",
                  "type",
                  "hour",
                  "place",
                  "distance"
                ],
                "additionalProperties": false
              },
              {
                "type": "object",
                "properties": {
                  "id": {
                    "type": "string",
                    "pattern": "^[A-Za-z0-9][A-Za-z0-9._-]*$",
                    "maxLength": 80
                  },
                  "type": {
                    "const": "distanceBetweenHours"
                  },
                  "hours": {
                    "type": "array",
                    "items": {
                      "type": "integer",
                      "minimum": 0,
                      "maximum": 6
                    },
                    "minItems": 2,
                    "maxItems": 2
                  },
                  "distance": {
                    "type": "integer",
                    "minimum": 0,
                    "maximum": 8
                  }
                },
                "required": [
                  "id",
                  "type",
                  "hours",
                  "distance"
                ],
                "additionalProperties": false
              },
              {
                "type": "object",
                "properties": {
                  "id": {
                    "type": "string",
                    "pattern": "^[A-Za-z0-9][A-Za-z0-9._-]*$",
                    "maxLength": 80
                  },
                  "type": {
                    "const": "countAdjacentToPlace"
                  },
                  "hours": {
                    "type": "array",
                    "items": {
                      "type": "integer",
                      "minimum": 0,
                      "maximum": 6
                    },
                    "minItems": 2,
                    "maxItems": 2
                  },
                  "place": {
                    "type": "string",
                    "pattern": "^[A-Za-z0-9][A-Za-z0-9._-]*$",
                    "maxLength": 80
                  },
                  "count": {
                    "type": "integer",
                    "minimum": 0,
                    "maximum": 7
                  }
                },
                "required": [
                  "id",
                  "type",
                  "hours",
                  "place",
                  "count"
                ],
                "additionalProperties": false
              }
            ]
          },
          "minItems": 1
        }
      },
      "required": [
        "grid",
        "start",
        "steps",
        "blocked",
        "places",
        "clues"
      ],
      "additionalProperties": false
    },
    "presentation": {
      "type": "object",
      "properties": {
        "title": {
          "type": "string",
          "minLength": 1,
          "maxLength": 12000
        },
        "intro": {
          "type": "array",
          "items": {
            "type": "string",
            "minLength": 1,
            "maxLength": 12000
          },
          "minItems": 1
        },
        "places": {
          "type": "object",
          "propertyNames": {
            "type": "string",
            "pattern": "^[A-Za-z0-9][A-Za-z0-9._-]*$",
            "maxLength": 80
          },
          "additionalProperties": {
            "type": "string",
            "minLength": 1,
            "maxLength": 12000
          }
        },
        "clues": {
          "type": "object",
          "propertyNames": {
            "type": "string",
            "pattern": "^[A-Za-z0-9][A-Za-z0-9._-]*$",
            "maxLength": 80
          },
          "additionalProperties": {
            "type": "string",
            "minLength": 1,
            "maxLength": 12000
          }
        },
        "hints": {
          "type": "array",
          "items": {
            "type": "string",
            "minLength": 1,
            "maxLength": 12000
          },
          "minItems": 0
        },
        "background": {
          "const": "meer-pergament"
        },
        "overlays": {
          "type": "array",
          "items": {
            "type": "object",
            "properties": {
              "asset": {
                "type": "string",
                "minLength": 1,
                "maxLength": 12000
              },
              "cells": {
                "type": "array",
                "items": {
                  "type": "string",
                  "pattern": "^[A-E][1-5]$"
                },
                "minItems": 1,
                "uniqueItems": true
              },
              "w": {
                "type": "number",
                "exclusiveMinimum": 0,
                "maximum": 600
              },
              "h": {
                "type": "number",
                "exclusiveMinimum": 0,
                "maximum": 600
              },
              "dx": {
                "type": "number",
                "minimum": -200,
                "maximum": 200
              },
              "dy": {
                "type": "number",
                "minimum": -200,
                "maximum": 200
              },
              "opacity": {
                "type": "number",
                "minimum": 0,
                "maximum": 1
              }
            },
            "required": [
              "asset",
              "cells",
              "w",
              "h",
              "dx",
              "dy",
              "opacity"
            ],
            "additionalProperties": false
          },
          "minItems": 0
        }
      },
      "required": [
        "title",
        "intro",
        "places",
        "clues",
        "hints",
        "background",
        "overlays"
      ],
      "additionalProperties": false
    },
    "solution": {
      "type": "array",
      "items": {
        "type": "string",
        "pattern": "^[A-E][1-5]$"
      },
      "minItems": 2,
      "uniqueItems": true
    },
    "resultTexts": {
      "type": "object",
      "properties": {
        "correct": {
          "type": "string",
          "minLength": 1,
          "maxLength": 12000
        },
        "incorrect": {
          "type": "string",
          "minLength": 1,
          "maxLength": 12000
        }
      },
      "required": [],
      "additionalProperties": false
    },
    "metadata": {
      "type": "object",
      "properties": {
        "kind": {
          "enum": [
            "reference",
            "test",
            "editorial",
            "historical"
          ]
        },
        "source": {
          "type": "string",
          "minLength": 1,
          "maxLength": 12000
        },
        "difficulty": {
          "type": "string",
          "minLength": 1,
          "maxLength": 12000
        }
      },
      "required": [
        "kind",
        "source"
      ],
      "additionalProperties": false
    }
  },
  "required": [
    "schemaVersion",
    "dataVersion",
    "id",
    "logic",
    "presentation"
  ],
  "additionalProperties": false
}
