{
  "schemaVersion": 1,
  "dataVersion": 1,
  "id": "reference-3.6",
  "logic": {
    "grid": {
      "columns": 5,
      "rows": 5
    },
    "start": "D4",
    "steps": 6,
    "blocked": [
      "B3",
      "C3",
      "E2"
    ],
    "places": {
      "tesoro": {
        "cells": [
          "B3",
          "C3"
        ],
        "kind": "island"
      },
      "lighthouse": {
        "cells": [
          "C1"
        ],
        "kind": "lighthouse"
      },
      "cliffs": {
        "kind": "island",
        "cells": [
          "E2"
        ]
      },
      "reef": {
        "kind": "reef",
        "cells": [
          "A3"
        ]
      },
      "wreck": {
        "kind": "wreck",
        "cells": [
          "E4"
        ]
      },
      "crab": {
        "kind": "landmark",
        "cells": [
          "D5"
        ]
      }
    },
    "clues": [
      {
        "id": "I",
        "type": "direction",
        "hour": 1,
        "direction": "NE"
      },
      {
        "id": "II",
        "type": "turn",
        "hour": 2,
        "degrees": -60
      },
      {
        "id": "III",
        "type": "adjacentToPlace",
        "hour": 4,
        "place": "tesoro"
      },
      {
        "id": "IV",
        "type": "direction",
        "hour": 6,
        "direction": "W"
      },
      {
        "id": "V",
        "type": "distanceToPlace",
        "hour": 5,
        "place": "lighthouse",
        "distance": 1
      },
      {
        "id": "VI",
        "type": "distanceBetweenHours",
        "hours": [
          1,
          3
        ],
        "distance": 2
      },
      {
        "id": "VII",
        "type": "countAdjacentToPlace",
        "hours": [
          3,
          6
        ],
        "place": "tesoro",
        "count": 2
      }
    ]
  },
  "presentation": {
    "title": "Der verschwundene Kompass",
    "intro": [
      "Robin hatte einen Kompass, Sam ein Logbuch und beide unterschiedliche Vorstellungen von einer Abkürzung. Nach sechs Stunden war der Kompass verschwunden. Die Route hatte Sam immerhin in sieben etwas eigenwilligen Beobachtungen festgehalten.",
      "Rekonstruiere die sechs Stunden zwischen Kurswechseln, Leuchtturm und Tesoro. Wo sind Robin und Sam schließlich gelandet? Unter „Spielregeln“ steht, wie das funktioniert."
    ],
    "places": {
      "tesoro": "Tesoro",
      "lighthouse": "Leuchtturm",
      "cliffs": "Klippen",
      "reef": "Riff",
      "wreck": "Wrack",
      "crab": "Krabbeninsel"
    },
    "clues": {
      "I": "In der ersten Stunde hielten wir Kurs nach Nordosten. Robin sagte, der Kompass habe dabei ausgesprochen überzeugt ausgesehen.",
      "II": "In der zweiten Stunde drehten wir den Kurs um genau 60° nach links. Sam notierte vorsichtshalber auch, dass links nicht dasselbe wie zurück bedeutet.",
      "III": "Nach Stunde 4 lag unser Boot direkt an der Küste von Tesoro – auf einem Wasserfeld mit gemeinsamer Hexseite zur Insel. Robin winkte einem Felsen zu.",
      "IV": "In der sechsten Stunde fuhren wir nach Westen. Das war laut Robin der kürzeste Weg nach irgendwohin.",
      "V": "Nach Stunde 5 waren wir genau ein Hexfeld vom Leuchtturm bei Gamma/Cyan entfernt. Sam konnte sogar die Möwen zählen.",
      "VI": "Zwischen unseren Positionen nach Stunde 1 und Stunde 3 lagen genau zwei Hexfelder Luftlinie. Auf dem Papier sah das ordentlicher aus als auf See.",
      "VII": "Zwischen Stunde 3 und Stunde 6 waren wir insgesamt zweimal direkt an der Küste von Tesoro. Sam zählte die Stunden; Robin hatte inzwischen den Kompass verlegt."
    },
    "hints": [
      "Hinweis I erlaubt direkt die erste Etappe: vom Startfeld aus genau einen Schritt nach Nordosten.",
      "Für Hinweis II drehe die erste Fahrtrichtung um eine Hexseite gegen den Uhrzeigersinn. So ergibt sich die zweite Etappe.",
      "Hinweis III betrifft nur Stunde 4: Die Position liegt auf einem befahrbaren Nachbarfeld von Tesoro.",
      "Hinweis IV sagt, in welche Richtung die letzte Etappe geht. Arbeite von möglichen Endfeldern rückwärts.",
      "Nutze „Abstände einblenden“ unter der Karte: Wähle den Leuchtturm als Bezugspunkt. Stunde 5 muss auf einem Feld mit Abstand 1 liegen.",
      "Vergleiche Stunde 1 und Stunde 3 mit der Abstandsanzeige. Die Luftlinie ist nicht die gefahrene Strecke.",
      "Zähle für Hinweis VII nur die Positionen der Stunden 3, 4, 5 und 6. Zwei davon müssen unmittelbar an Tesoro liegen."
    ],
    "background": "meer-pergament",
    "overlays": [
      {
        "asset": "insel-einzeln-01.png",
        "cells": [
          "E2"
        ],
        "w": 76,
        "h": 76,
        "dx": 0,
        "dy": 0,
        "opacity": 0.85
      },
      {
        "asset": "insel-zweier-01.png",
        "cells": [
          "B3",
          "C3"
        ],
        "w": 144,
        "h": 124,
        "dx": 0,
        "dy": 0,
        "opacity": 0.88
      },
      {
        "asset": "segelboot-01.png",
        "cells": [
          "D4"
        ],
        "w": 60,
        "h": 47,
        "dx": 0,
        "dy": 0,
        "opacity": 0.83
      },
      {
        "asset": "leuchtturm-01.png",
        "cells": [
          "C1"
        ],
        "w": 68,
        "h": 68,
        "dx": 0,
        "dy": 0,
        "opacity": 0.92
      },
      {
        "asset": "riff-01.png",
        "cells": [
          "A3"
        ],
        "w": 68,
        "h": 66,
        "dx": 0,
        "dy": 0,
        "opacity": 0.76
      },
      {
        "asset": "insel-einzeln-02.png",
        "cells": [
          "D5"
        ],
        "w": 64,
        "h": 64,
        "dx": 0,
        "dy": 0,
        "opacity": 0.82
      },
      {
        "asset": "segelboot-02.png",
        "cells": [
          "E4"
        ],
        "w": 61,
        "h": 51,
        "dx": 0,
        "dy": 0,
        "opacity": 0.77
      },
      {
        "asset": "krabbe-01.png",
        "cells": [
          "D5"
        ],
        "w": 45,
        "h": 42,
        "dx": 0,
        "dy": 0,
        "opacity": 0.32
      }
    ]
  },
  "solution": [
    "D4",
    "E3",
    "D2",
    "C2",
    "B2",
    "B1",
    "A1"
  ],
  "metadata": {
    "source": "prototypes/3.6/index.html",
    "kind": "reference"
  }
}
