{
  "schemaVersion": 1,
  "dataVersion": 1,
  "id": "f03-contract-fixture",
  "logic": {
    "grid": {"columns": 5, "rows": 5},
    "start": "C3",
    "steps": 1,
    "blocked": [],
    "places": {},
    "clues": [{"id": "A", "type": "direction", "hour": 1, "direction": "E"}]
  },
  "presentation": {
    "title": "F03 contract fixture",
    "intro": ["Technical fixture; not a published puzzle."],
    "places": {},
    "clues": {"A": "Travel east."},
    "hints": ["East is the right-hand neighbour."],
    "background": "meer-pergament",
    "overlays": []
  },
  "solution": ["C3", "D3"],
  "metadata": {"kind": "test", "source": "internal author provenance"}
}
