{
  "schemaVersion": 1,
  "dataVersion": 1,
  "id": "test-navigation",
  "logic": {
    "grid": {
      "columns": 5,
      "rows": 5
    },
    "start": "A5",
    "steps": 6,
    "blocked": [
      "C3",
      "D3",
      "E1"
    ],
    "places": {
      "island": {
        "kind": "island",
        "cells": [
          "C3",
          "D3"
        ]
      },
      "cliffs": {
        "kind": "island",
        "cells": [
          "E1"
        ]
      },
      "beacon": {
        "kind": "lighthouse",
        "cells": [
          "A1"
        ]
      }
    },
    "clues": [
      {
        "id": "T1",
        "type": "position",
        "hour": 1,
        "cell": "B5"
      },
      {
        "id": "T2",
        "type": "position",
        "hour": 2,
        "cell": "C5"
      },
      {
        "id": "T3",
        "type": "position",
        "hour": 3,
        "cell": "D5"
      },
      {
        "id": "T4",
        "type": "position",
        "hour": 4,
        "cell": "E5"
      },
      {
        "id": "T5",
        "type": "position",
        "hour": 5,
        "cell": "E4"
      },
      {
        "id": "T6",
        "type": "position",
        "hour": 6,
        "cell": "D4"
      }
    ]
  },
  "presentation": {
    "title": "Technischer Testfall – Navigation",
    "intro": [
      "Ausdrücklich technischer Testfall für Rätselauswahl und getrennte Spielstände. Kein historisches oder redaktionelles Rätsel.",
      "Sechs feste Positionen prüfen eine andere Karte, einen anderen Start und andere Orte."
    ],
    "places": {
      "island": "Testinsel",
      "cliffs": "Testklippen",
      "beacon": "Testfeuer"
    },
    "clues": {
      "T1": "Nach Stunde 1 liegt das Boot auf B5.",
      "T2": "Nach Stunde 2 liegt das Boot auf C5.",
      "T3": "Nach Stunde 3 liegt das Boot auf D5.",
      "T4": "Nach Stunde 4 liegt das Boot auf E5.",
      "T5": "Nach Stunde 5 liegt das Boot auf E4.",
      "T6": "Nach Stunde 6 liegt das Boot auf D4."
    },
    "hints": [
      "Beginne beim vorgegebenen Start. Der erste Testhinweis nennt das nächste Feld direkt."
    ],
    "background": "meer-pergament",
    "overlays": [
      {
        "asset": "insel-zweier-01.png",
        "cells": [
          "C3",
          "D3"
        ],
        "w": 144,
        "h": 124,
        "dx": 0,
        "dy": 0,
        "opacity": 0.88
      },
      {
        "asset": "insel-einzeln-01.png",
        "cells": [
          "E1"
        ],
        "w": 76,
        "h": 76,
        "dx": 0,
        "dy": 0,
        "opacity": 0.85
      },
      {
        "asset": "segelboot-01.png",
        "cells": [
          "A5"
        ],
        "w": 60,
        "h": 47,
        "dx": 0,
        "dy": 0,
        "opacity": 0.83
      },
      {
        "asset": "leuchtturm-01.png",
        "cells": [
          "A1"
        ],
        "w": 68,
        "h": 68,
        "dx": 0,
        "dy": 0,
        "opacity": 0.92
      }
    ]
  },
  "solution": [
    "A5",
    "B5",
    "C5",
    "D5",
    "E5",
    "E4",
    "D4"
  ],
  "metadata": {
    "kind": "test",
    "source": "Synthetic integration fixture; not a historical puzzle"
  }
}
